{
  "content": {
    "follow_up_questions": [
      "Which findings should be promoted into a human-readable report?",
      "Do the declared comparison scope and alignment still match the analytical intent?"
    ],
    "headline": "Coverage and comparison results are available for interpretation.",
    "key_points": [
      "ce_coverage.json: Coverage overall is representable.",
      "ce_coverage.json: 6 coverage finding(s) are representable.",
      "bp_coverage.json: Coverage overall is representable.",
      "bp_coverage.json: 6 coverage finding(s) are representable.",
      "ce_bp_compare.json: Comparison signal: constraint_density: constraint_density decreased by 0.4602446483180427, suggesting weaker explicitness.",
      "ce_bp_compare.json: Comparison signal: cardinality_bounded_property_share: cardinality_bounded_property_share increased by 0.08868501529051986, suggesting stronger explicitness.",
      "ce_bp_compare.json: Comparison signal: shared_vocabulary_overlap_ratio: shared_vocabulary_overlap_ratio decreased by 0.06516290726817042, suggesting less vocabulary reuse.",
      "ce_bp_compare.json: Declared alignment coverage is 1.0 with 4 matched pair(s).",
      "ce_prioritize.json: 3 prioritization target(s) were emitted.",
      "ce_prioritize.json: Priority 1: comparison_metric_delta_2: cardinality_bounded_property_share increased by 0.08868501529051986, suggesting stronger explicitness.",
      "ce_prioritize.json: Priority 2: comparison_metric_delta_4: typed_property_share increased by 0.033639143730886834, suggesting stronger explicitness.",
      "ce_prioritize.json: Priority 3: maintainability_redundancy_candidates: 11 redundancy candidates were detected across the assessed profile."
    ],
    "result_types": [
      "coverage_result",
      "coverage_result",
      "comparison_result",
      "prioritization_result"
    ]
  },
  "diagnostics": [],
  "inputs": {
    "result_count": 4,
    "result_paths": [
      "/tmp/ce_coverage.json",
      "/tmp/bp_coverage.json",
      "/tmp/ce_bp_compare.json",
      "/tmp/ce_prioritize.json"
    ]
  },
  "result_type": "summary_result"
}
